Tier 1 Suppliers,Producer Name,Abbreviation Name,Region,Source
Barry Callebaut AG,ste coop anouanze de n'denou,s.ca-ca,,MDLZ Cocoa Life Tier 1 and Tier 2 Suppliers - 2021
Barry Callebaut AG,ste coop agri allakabo de gly,caag coop-ca,,MDLZ Cocoa Life Tier 1 and Tier 2 Suppliers - 2022
Barry Callebaut AG,ste coop agri akayara de datta,scoopaad_datta,,MDLZ Cocoa Life Tier 1 and Tier 2 Suppliers - 2023
Barry Callebaut AG,ste coop des producteurs de m'bokro,coop ca pm,,MDLZ Cocoa Life Tier 1 and Tier 2 Suppliers - 2024
Barry Callebaut AG,ste coop s ewounbo de tiassale,ewounbo tiassale,,MDLZ Cocoa Life Tier 1 and Tier 2 Suppliers - 2025
Barry Callebaut AG,ste gle d'achat et de distribution,sogad,,MDLZ Cocoa Life Tier 1 and Tier 2 Suppliers - 2026
Barry Callebaut AG,ste coop agri n'zassa de tiassale,scapen,,MDLZ Cocoa Life Tier 1 and Tier 2 Suppliers - 2027
Barry Callebaut AG,entr coop de gabiadji,ecoga_coop-ca,,MDLZ Cocoa Life Tier 1 and Tier 2 Suppliers - 2028
Barry Callebaut AG,ent coop agri de dagadji,ecada,,MDLZ Cocoa Life Tier 1 and Tier 2 Suppliers - 2029
Barry Callebaut AG,ste coop agri cot lauzoua carrefour,copacol,,MDLZ Cocoa Life Tier 1 and Tier 2 Suppliers - 2030
Barry Callebaut AG,ste coop yeyasso de man,scoops-yeyasso,,MDLZ Cocoa Life Tier 1 and Tier 2 Suppliers - 2031
Barry Callebaut AG,ste coop agricole de vavoua,scoava,,MDLZ Cocoa Life Tier 1 and Tier 2 Suppliers - 2032
Barry Callebaut AG,ste coop av ca ecoagricole de pont nero,ecoan,,MDLZ Cocoa Life Tier 1 and Tier 2 Suppliers - 2033
Barry Callebaut AG,ste coop simp bada de ketro bassam,cabak scoops,,MDLZ Cocoa Life Tier 1 and Tier 2 Suppliers - 2034
Barry Callebaut AG,coop des prod agri dept yakasse,coopadya,,MDLZ Cocoa Life Tier 1 and Tier 2 Suppliers - 2035
Barry Callebaut AG,ste coop espoir simplifiee,scoes scoops,,MDLZ Cocoa Life Tier 1 and Tier 2 Suppliers - 2036
Barry Callebaut AG,ste coop lafi la boumbou,lafila boumbou,,MDLZ Cocoa Life Tier 1 and Tier 2 Suppliers - 2037
Barry Callebaut AG,ste coop ivoir de nouveaux agriculteur,coopina coop-ca,,MDLZ Cocoa Life Tier 1 and Tier 2 Suppliers - 2038
Barry Callebaut AG,ste coop des jeunes agricult de borobo,coojab coop-ca,,MDLZ Cocoa Life Tier 1 and Tier 2 Suppliers - 2039
Barry Callebaut AG,ste coop elite coop agri blolequin,ecab_blolequi,,MDLZ Cocoa Life Tier 1 and Tier 2 Suppliers - 2040
Barry Callebaut AG,cooperative agricole siakadougou de bida,casib coop-ca,,MDLZ Cocoa Life Tier 1 and Tier 2 Suppliers - 2041
Barry Callebaut AG,ste coop des prod agri de duekoue,coopad_duekoue,,MDLZ Cocoa Life Tier 1 and Tier 2 Suppliers - 2042
Barry Callebaut AG,ste coop agri nesmon,scan coop-ca,,MDLZ Cocoa Life Tier 1 and Tier 2 Suppliers - 2043
Barry Callebaut AG,ste coop simpl allah kabo de duekoue,allah-kabo scoops,,MDLZ Cocoa Life Tier 1 and Tier 2 Suppliers - 2044
Barry Callebaut AG,ste coop de cafe-cacao ivoirien,sococci scoops,,MDLZ Cocoa Life Tier 1 and Tier 2 Suppliers - 2045
Barry Callebaut AG,ste coop phenix de product agri durable,pheniprad,,MDLZ Cocoa Life Tier 1 and Tier 2 Suppliers - 2046
Barry Callebaut AG,ste coop des prod agri du fromager,scopaf,,MDLZ Cocoa Life Tier 1 and Tier 2 Suppliers - 2047
Cargill Cocoa and Chocolate,cooperative bassabougou de dies avec conseil d administration,coobadi coop-ca,,MDLZ Cocoa Life Tier 1 and Tier 2 Suppliers - 2048
Cargill Cocoa and Chocolate,cooperative agricole affoubenou de diegonefla,coopaadi coop-ca,,MDLZ Cocoa Life Tier 1 and Tier 2 Suppliers - 2049
Cargill Cocoa and Chocolate,cooperative agricole du guemon,coop-ca c.a.g,,MDLZ Cocoa Life Tier 1 and Tier 2 Suppliers - 2050
Cargill Cocoa and Chocolate,cooperative agricole ambegnafe de duekoue,coop-ca camd,,MDLZ Cocoa Life Tier 1 and Tier 2 Suppliers - 2051
Cargill Cocoa and Chocolate,cooperative agricole aclomion bla de duekoue,coop-ca-cabd,,MDLZ Cocoa Life Tier 1 and Tier 2 Suppliers - 2052
Cargill Cocoa and Chocolate,cooperative agricole benguema de duekoue,coop-ca-cabend,,MDLZ Cocoa Life Tier 1 and Tier 2 Suppliers - 2053
Cargill Cocoa and Chocolate,cooperative des producteurs agricoles bebitafo de duekoue,coop-ca-cooprabed,,MDLZ Cocoa Life Tier 1 and Tier 2 Suppliers - 2054
Cargill Cocoa and Chocolate,cooperative reference de jacob,coop-ca-reja,,MDLZ Cocoa Life Tier 1 and Tier 2 Suppliers - 2055
Cargill Cocoa and Chocolate,cooperative entente de la bla,coopebia-ca,,MDLZ Cocoa Life Tier 1 and Tier 2 Suppliers - 2056
Cargill Cocoa and Chocolate,cooperative kone guido sidibe,kgs coop-ca,,MDLZ Cocoa Life Tier 1 and Tier 2 Suppliers - 2057
Cargill Cocoa and Chocolate,cooperative agrocile de koffikro,scoopakof coop-ca,,MDLZ Cocoa Life Tier 1 and Tier 2 Suppliers - 2058
Cargill Cocoa and Chocolate,cooperative agricole renaissance de bianouan,socarebia coop-ca,,MDLZ Cocoa Life Tier 1 and Tier 2 Suppliers - 2059
Cargill Cocoa and Chocolate,societe cooperative agricole gnamien oble de songan,socoopagos coop-ca,,MDLZ Cocoa Life Tier 1 and Tier 2 Suppliers - 2060
Ecom Agrotrade Ltd,societe cooperative agricole espoir de blolequin,scaeb,,MDLZ Cocoa Life Tier 1 and Tier 2 Suppliers - 2061
Ecom Agrotrade Ltd,societe cooperative agricole de nougbatchi,coopanou,,MDLZ Cocoa Life Tier 1 and Tier 2 Suppliers - 2062
Ecom Agrotrade Ltd,cooperative agricole toumtoumda du haut sassandra,coopaths - scoops,,MDLZ Cocoa Life Tier 1 and Tier 2 Suppliers - 2063
Ecom Agrotrade Ltd,cooperative victoire de meagui,covimea,,MDLZ Cocoa Life Tier 1 and Tier 2 Suppliers - 2064
Ecom Agrotrade Ltd,entreprise cooperative des agriculteurs de meagui,ecafhs coop ca,,MDLZ Cocoa Life Tier 1 and Tier 2 Suppliers - 2065
Ecom Agrotrade Ltd,scoiete cooperative elie tipka du haut sasandra,ecam,,MDLZ Cocoa Life Tier 1 and Tier 2 Suppliers - 2066
Ecom Agrotrade Ltd,societe cooperative simplifiee sabarykagni du haut sassandra,"scaeths
scoops sahs",,MDLZ Cocoa Life Tier 1 and Tier 2 Suppliers - 2067
Olam International Limited,cooperative agricole boribana de hermankono garo,cabohga coop ca,,MDLZ Cocoa Life Tier 1 and Tier 2 Suppliers - 2068
Olam International Limited,societe cooperative agricole des producteurs de lobogrou,coop-ca-capl,,MDLZ Cocoa Life Tier 1 and Tier 2 Suppliers - 2069
Olam International Limited,societe cooperative agricole de guitry,coop-ca-socoagui,,MDLZ Cocoa Life Tier 1 and Tier 2 Suppliers - 2070
Olam International Limited,societe cooperative agricole de djimon,scoopadji coop ca,,MDLZ Cocoa Life Tier 1 and Tier 2 Suppliers - 2070
Olam International Limited,societe cooperative agricole de soubre,scasou-coop-ca,,MDLZ Cocoa Life Tier 1 and Tier 2 Suppliers - 2071
Olam International Limited,societe cooperative agricole de jeromekro,socaj coop-ca,,MDLZ Cocoa Life Tier 1 and Tier 2 Suppliers - 2072
Olam International Limited,societe cooperative des freres unis de watte,scuw coop-ca,,MDLZ Cocoa Life Tier 1 and Tier 2 Suppliers - 2073
Olam International Limited,societe cooperative agricole des producteurs agricoles de cavally,scoopac-coop ca,,MDLZ Cocoa Life Tier 1 and Tier 2 Suppliers - 2074
Olam International Limited,societe cooperative solidarite de mahino,socosom-coop-ca,,MDLZ Cocoa Life Tier 1 and Tier 2 Suppliers - 2075
Olam International Limited,societe cooperative agricole de neka-cite,socanek-coop-ca,,MDLZ Cocoa Life Tier 1 and Tier 2 Suppliers - 2076
Olam International Limited,societe cooperative agricole de amanikro,coop-ca coopaa,,MDLZ Cocoa Life Tier 1 and Tier 2 Suppliers - 2077
Olam International Limited,societe cooperative nobielto de bettie avec conseil d'administration,coop ca nobielto,,MDLZ Cocoa Life Tier 1 and Tier 2 Suppliers - 2078
Olam International Limited,societe cooperative avec conseil d'administration wende waoga de kahen,s.c.2w.k.coop-ca,,MDLZ Cocoa Life Tier 1 and Tier 2 Suppliers - 2079
Olam International Limited,societe cooperative simplifiee d'ananguie,scoop scsag,,MDLZ Cocoa Life Tier 1 and Tier 2 Suppliers - 2080
Olam International Limited,societe cooperative simplifiee agricole lafi bebe de man,scoop lafi bebe,,MDLZ Cocoa Life Tier 1 and Tier 2 Suppliers - 2081
Olam International Limited,societe cooperative agricole de para nigre,scoop scoapani,,MDLZ Cocoa Life Tier 1 and Tier 2 Suppliers - 2082
Ofi,cooperative agricole avec conseil d'administration anouanze d'abongoua,caaa,Abongoua,https://www.ofi.com/content/dam/olamofi/sustainability/sustainability-pdfs/COTE-D%27IVOIRE-ofi-sustainable-cocoa-suppliers-2022.pdf
Ofi,societe cooperative agricole dabronamoue,caabro,Abengourou,https://www.ofi.com/content/dam/olamofi/sustainability/sustainability-pdfs/COTE-D%27IVOIRE-ofi-sustainable-cocoa-suppliers-2022.pdf
Ofi,societe cooperative agricole adzope nord,caan,Adzopé,https://www.ofi.com/content/dam/olamofi/sustainability/sustainability-pdfs/COTE-D%27IVOIRE-ofi-sustainable-cocoa-suppliers-2022.pdf
Ofi,cooperative agricole de bahe-sebon,caba,Bahe-Sebon,https://www.ofi.com/content/dam/olamofi/sustainability/sustainability-pdfs/COTE-D%27IVOIRE-ofi-sustainable-cocoa-suppliers-2022.pdf
Ofi,cooperative bacon espoir,cabes,Bâcon,https://www.ofi.com/content/dam/olamofi/sustainability/sustainability-pdfs/COTE-D%27IVOIRE-ofi-sustainable-cocoa-suppliers-2022.pdf
Ofi,cooperative agricole binkeleman de gboguhe,cabg scoops,Daloa,https://www.ofi.com/content/dam/olamofi/sustainability/sustainability-pdfs/COTE-D%27IVOIRE-ofi-sustainable-cocoa-suppliers-2022.pdf
Ofi,societe cooperative agricole binkadi de guepahouo,cabing,Guépahouo,https://www.ofi.com/content/dam/olamofi/sustainability/sustainability-pdfs/COTE-D%27IVOIRE-ofi-sustainable-cocoa-suppliers-2022.pdf
Ofi,cooperative agricole boribana de hermankono garo,cabohga coop ca,Hermakono Garo,https://www.ofi.com/content/dam/olamofi/sustainability/sustainability-pdfs/COTE-D%27IVOIRE-ofi-sustainable-cocoa-suppliers-2022.pdf
Ofi,societe cooperative agricole de cefi,cac,Dogbo,https://www.ofi.com/content/dam/olamofi/sustainability/sustainability-pdfs/COTE-D%27IVOIRE-ofi-sustainable-cocoa-suppliers-2022.pdf
Ofi,cooperative agricole djidjiya de blolequin,cadb,Bloléquin,https://www.ofi.com/content/dam/olamofi/sustainability/sustainability-pdfs/COTE-D%27IVOIRE-ofi-sustainable-cocoa-suppliers-2022.pdf
Ofi,cooperative agricole pour le developpement durable d'oussoukro,cadedo,Meagui,https://www.ofi.com/content/dam/olamofi/sustainability/sustainability-pdfs/COTE-D%27IVOIRE-ofi-sustainable-cocoa-suppliers-2022.pdf
Ofi,cooperative agricole pour le developpement de sassandra,cadesa,Adebem,https://www.ofi.com/content/dam/olamofi/sustainability/sustainability-pdfs/COTE-D%27IVOIRE-ofi-sustainable-cocoa-suppliers-2022.pdf
Ofi,societe cooperative agricole djiguiya de teapleu,cadt,Téapleu,https://www.ofi.com/content/dam/olamofi/sustainability/sustainability-pdfs/COTE-D%27IVOIRE-ofi-sustainable-cocoa-suppliers-2022.pdf
Ofi,cooperative agricole ekloewou de gbapleu,caeg,Duékoué,https://www.ofi.com/content/dam/olamofi/sustainability/sustainability-pdfs/COTE-D%27IVOIRE-ofi-sustainable-cocoa-suppliers-2022.pdf
Ofi,societe cooperative agricole entraide de kotobi,caek,Kotobi,https://www.ofi.com/content/dam/olamofi/sustainability/sustainability-pdfs/COTE-D%27IVOIRE-ofi-sustainable-cocoa-suppliers-2022.pdf
Ofi,cooperative agricole des freres unis de bonon,cafub,Bonon,https://www.ofi.com/content/dam/olamofi/sustainability/sustainability-pdfs/COTE-D%27IVOIRE-ofi-sustainable-cocoa-suppliers-2022.pdf
Ofi,societe cooperative agricole kangreta de bonon,cakb,Bonon,https://www.ofi.com/content/dam/olamofi/sustainability/sustainability-pdfs/COTE-D%27IVOIRE-ofi-sustainable-cocoa-suppliers-2022.pdf
Ofi,"societe cooperative agricole avec conseil
dadministration leader de bon blanc",cal2b,Sahoua,https://www.ofi.com/content/dam/olamofi/sustainability/sustainability-pdfs/COTE-D%27IVOIRE-ofi-sustainable-cocoa-suppliers-2022.pdf
Ofi,cooperative agricole avec conseil d'administration mawoubie d'apprompron,camap,Abengourou,https://www.ofi.com/content/dam/olamofi/sustainability/sustainability-pdfs/COTE-D%27IVOIRE-ofi-sustainable-cocoa-suppliers-2022.pdf
Ofi,cooperative agricole des montagnes de biankouma,camobian,Man,https://www.ofi.com/content/dam/olamofi/sustainability/sustainability-pdfs/COTE-D%27IVOIRE-ofi-sustainable-cocoa-suppliers-2022.pdf
Ofi,cooperative allakabo du n'zo de kahen,cank,Duékoué,https://www.ofi.com/content/dam/olamofi/sustainability/sustainability-pdfs/COTE-D%27IVOIRE-ofi-sustainable-cocoa-suppliers-2022.pdf
Ofi,cooperative agricole n'drikro sinfra,cans,Gagnoa,https://www.ofi.com/content/dam/olamofi/sustainability/sustainability-pdfs/COTE-D%27IVOIRE-ofi-sustainable-cocoa-suppliers-2022.pdf
Ofi,cooperative des producteurs d'assiekro,capa,Abengourou,https://www.ofi.com/content/dam/olamofi/sustainability/sustainability-pdfs/COTE-D%27IVOIRE-ofi-sustainable-cocoa-suppliers-2022.pdf
Ofi,cooperative agricole la paix de blolequin,capb,Duékoué,https://www.ofi.com/content/dam/olamofi/sustainability/sustainability-pdfs/COTE-D%27IVOIRE-ofi-sustainable-cocoa-suppliers-2022.pdf
Ofi,cooperative agricole la paix de la marahoue,capm,Bonon,https://www.ofi.com/content/dam/olamofi/sustainability/sustainability-pdfs/COTE-D%27IVOIRE-ofi-sustainable-cocoa-suppliers-2022.pdf
Ofi,societe cooperative des producteurs d'oupoyo,capo,Opouyo,https://www.ofi.com/content/dam/olamofi/sustainability/sustainability-pdfs/COTE-D%27IVOIRE-ofi-sustainable-cocoa-suppliers-2022.pdf
Ofi,cooperative agricole d'agnitie d'apprompron,capressa,Abengourou,https://www.ofi.com/content/dam/olamofi/sustainability/sustainability-pdfs/COTE-D%27IVOIRE-ofi-sustainable-cocoa-suppliers-2022.pdf
Ofi,cooperative agricole le progres de duekoue,caprod,Duékoué,https://www.ofi.com/content/dam/olamofi/sustainability/sustainability-pdfs/COTE-D%27IVOIRE-ofi-sustainable-cocoa-suppliers-2022.pdf
Ofi,societe cooperative simplifiee coope rative agricole la renaissance de bonon,carebo,Bonon,https://www.ofi.com/content/dam/olamofi/sustainability/sustainability-pdfs/COTE-D%27IVOIRE-ofi-sustainable-cocoa-suppliers-2022.pdf
Ofi,cooperative agricole la renaissance de vavoua,careva,Vavoua,https://www.ofi.com/content/dam/olamofi/sustainability/sustainability-pdfs/COTE-D%27IVOIRE-ofi-sustainable-cocoa-suppliers-2022.pdf
Ofi,societe cooperative des agriculteurs solidaires de duekoue,casodu,Duékoué,https://www.ofi.com/content/dam/olamofi/sustainability/sustainability-pdfs/COTE-D%27IVOIRE-ofi-sustainable-cocoa-suppliers-2022.pdf
Ofi,cooperative agricole la tolerance de bonoufla,catb,Bonoufla,https://www.ofi.com/content/dam/olamofi/sustainability/sustainability-pdfs/COTE-D%27IVOIRE-ofi-sustainable-cocoa-suppliers-2022.pdf
Ofi,cooperative espoir agnikro d'abengourou,ceaa coop ca,Abengourou,https://www.ofi.com/content/dam/olamofi/sustainability/sustainability-pdfs/COTE-D%27IVOIRE-ofi-sustainable-cocoa-suppliers-2022.pdf
Ofi,cooperative agricole entente de mahapleu,cema,Mahapleu,https://www.ofi.com/content/dam/olamofi/sustainability/sustainability-pdfs/COTE-D%27IVOIRE-ofi-sustainable-cocoa-suppliers-2022.pdf
Ofi,societe cooperative simplifiee des jeunes de kahen,cjpk,Kahen,https://www.ofi.com/content/dam/olamofi/sustainability/sustainability-pdfs/COTE-D%27IVOIRE-ofi-sustainable-cocoa-suppliers-2022.pdf
Ofi,societe cooperative de la nouvelle alliance du dandji,cnad,Yaou/Aboisso,https://www.ofi.com/content/dam/olamofi/sustainability/sustainability-pdfs/COTE-D%27IVOIRE-ofi-sustainable-cocoa-suppliers-2022.pdf
Ofi,societe cooperative agricole cambonou de arrah,coaka,Arrah,https://www.ofi.com/content/dam/olamofi/sustainability/sustainability-pdfs/COTE-D%27IVOIRE-ofi-sustainable-cocoa-suppliers-2022.pdf
Ofi,cooperative agricole de la marahoue,coam,Daloa,https://www.ofi.com/content/dam/olamofi/sustainability/sustainability-pdfs/COTE-D%27IVOIRE-ofi-sustainable-cocoa-suppliers-2022.pdf
Ofi,cooperative pour le developpement de la region des lacs,coderlacs,Toumodi,https://www.ofi.com/content/dam/olamofi/sustainability/sustainability-pdfs/COTE-D%27IVOIRE-ofi-sustainable-cocoa-suppliers-2022.pdf
Ofi,societe cooperative espoir d'agnanfoutou,coesag,Ananguié,https://www.ofi.com/content/dam/olamofi/sustainability/sustainability-pdfs/COTE-D%27IVOIRE-ofi-sustainable-cocoa-suppliers-2022.pdf
Ofi,cooperative agricole anouanze de bettie avec conseil d'administration,cooaab-coop ca,Abengourou,https://www.ofi.com/content/dam/olamofi/sustainability/sustainability-pdfs/COTE-D%27IVOIRE-ofi-sustainable-cocoa-suppliers-2022.pdf
Ofi,cooperative bassadougou de dies,coobadi,Hermankono-Dies,https://www.ofi.com/content/dam/olamofi/sustainability/sustainability-pdfs/COTE-D%27IVOIRE-ofi-sustainable-cocoa-suppliers-2022.pdf
Ofi,cooperative avec conseil d'administration abotre,coop ca abotre,Abengourou,https://www.ofi.com/content/dam/olamofi/sustainability/sustainability-pdfs/COTE-D%27IVOIRE-ofi-sustainable-cocoa-suppliers-2022.pdf
Ofi,societe cooperative des agriculteurs de n'zuekro ii,coop ca anzue ii,Djoroplo,https://www.ofi.com/content/dam/olamofi/sustainability/sustainability-pdfs/COTE-D%27IVOIRE-ofi-sustainable-cocoa-suppliers-2022.pdf
Ofi,cooperative avec conseil d'administration birba,coop ca birba,Sasa-manois,https://www.ofi.com/content/dam/olamofi/sustainability/sustainability-pdfs/COTE-D%27IVOIRE-ofi-sustainable-cocoa-suppliers-2022.pdf
Ofi,cooperative agricole de nicolakro,coop ca coani,Gagny,https://www.ofi.com/content/dam/olamofi/sustainability/sustainability-pdfs/COTE-D%27IVOIRE-ofi-sustainable-cocoa-suppliers-2022.pdf
Ofi,societe cooperative espoir d'angouakro,coop ca espoir,Abengourou,https://www.ofi.com/content/dam/olamofi/sustainability/sustainability-pdfs/COTE-D%27IVOIRE-ofi-sustainable-cocoa-suppliers-2022.pdf
Ofi,societe cooperative global crop du tonkpi,coop ca gct,Man,https://www.ofi.com/content/dam/olamofi/sustainability/sustainability-pdfs/COTE-D%27IVOIRE-ofi-sustainable-cocoa-suppliers-2022.pdf
Ofi,cooperative avec conseil d'administration reference de sinfra,caref si,Sinfra,https://www.ofi.com/content/dam/olamofi/sustainability/sustainability-pdfs/COTE-D%27IVOIRE-ofi-sustainable-cocoa-suppliers-2022.pdf
Ofi,societe cooperative des cacaoculteurs de nado avec conseil d'administration,coop ca soccna,Nando,https://www.ofi.com/content/dam/olamofi/sustainability/sustainability-pdfs/COTE-D%27IVOIRE-ofi-sustainable-cocoa-suppliers-2022.pdf
Ofi,societe cooperative agricole avec conseil d'administration entente de seguela,coop caes,Daloa,https://www.ofi.com/content/dam/olamofi/sustainability/sustainability-pdfs/COTE-D%27IVOIRE-ofi-sustainable-cocoa-suppliers-2022.pdf
Ofi,societe cooperative des jeunes agriculteurs de vavoua,coop java,Vavoua,https://www.ofi.com/content/dam/olamofi/sustainability/sustainability-pdfs/COTE-D%27IVOIRE-ofi-sustainable-cocoa-suppliers-2022.pdf
Ofi,jeunesse cooperative agricole de sourougou,coop jcas,Bonon,https://www.ofi.com/content/dam/olamofi/sustainability/sustainability-pdfs/COTE-D%27IVOIRE-ofi-sustainable-cocoa-suppliers-2022.pdf
Ofi,societe cooperative agricole teegawende,coop teega wende,Kahen,https://www.ofi.com/content/dam/olamofi/sustainability/sustainability-pdfs/COTE-D%27IVOIRE-ofi-sustainable-cocoa-suppliers-2022.pdf
Ofi,societe cooperative avec conseil d'administration benkadi de siakakro,coopabenkadi,Abengourou,https://www.ofi.com/content/dam/olamofi/sustainability/sustainability-pdfs/COTE-D%27IVOIRE-ofi-sustainable-cocoa-suppliers-2022.pdf
Ofi,cooperative agricole du canton d'amelikia,coopaca,Abengourou,https://www.ofi.com/content/dam/olamofi/sustainability/sustainability-pdfs/COTE-D%27IVOIRE-ofi-sustainable-cocoa-suppliers-2022.pdf
Ofi,societe cooperative simplifiee des agriculteurs cafe- cacao de divo-menehiri,coopadim,Divo,https://www.ofi.com/content/dam/olamofi/sustainability/sustainability-pdfs/COTE-D%27IVOIRE-ofi-sustainable-cocoa-suppliers-2022.pdf
Ofi,societe cooperative agricole de gagny,coopagagny,Gagny,https://www.ofi.com/content/dam/olamofi/sustainability/sustainability-pdfs/COTE-D%27IVOIRE-ofi-sustainable-cocoa-suppliers-2022.pdf
Ofi,cooperative agricole du garo,coopagaro,Divo,https://www.ofi.com/content/dam/olamofi/sustainability/sustainability-pdfs/COTE-D%27IVOIRE-ofi-sustainable-cocoa-suppliers-2022.pdf
Ofi,cooperative espoir de guepahouo,coopages,Guépahouo,https://www.ofi.com/content/dam/olamofi/sustainability/sustainability-pdfs/COTE-D%27IVOIRE-ofi-sustainable-cocoa-suppliers-2022.pdf
Ofi,cooperative agricole de gnipi 2,coopagnipi,Gnipi 2,https://www.ofi.com/content/dam/olamofi/sustainability/sustainability-pdfs/COTE-D%27IVOIRE-ofi-sustainable-cocoa-suppliers-2022.pdf
Ofi,cooperative agricole de goudouko,coopago,Lakota,https://www.ofi.com/content/dam/olamofi/sustainability/sustainability-pdfs/COTE-D%27IVOIRE-ofi-sustainable-cocoa-suppliers-2022.pdf
Ofi,cooperative agricole here de kranzadougou,coopahk,Guiglo,https://www.ofi.com/content/dam/olamofi/sustainability/sustainability-pdfs/COTE-D%27IVOIRE-ofi-sustainable-cocoa-suppliers-2022.pdf
Ofi,societe cooperative kishwensida cochem-dida,coopakcodi,Divo,https://www.ofi.com/content/dam/olamofi/sustainability/sustainability-pdfs/COTE-D%27IVOIRE-ofi-sustainable-cocoa-suppliers-2022.pdf
Ofi,cooperative agricole de kokolilie,coopakoko,Kokolilie (Lakota),https://www.ofi.com/content/dam/olamofi/sustainability/sustainability-pdfs/COTE-D%27IVOIRE-ofi-sustainable-cocoa-suppliers-2022.pdf
Ofi,cooperative agricole de lassinan bango,coopalba,Mene Centre,https://www.ofi.com/content/dam/olamofi/sustainability/sustainability-pdfs/COTE-D%27IVOIRE-ofi-sustainable-cocoa-suppliers-2022.pdf
Ofi,societe cooperative agricole moderne de divo,coopamdi,Divo,https://www.ofi.com/content/dam/olamofi/sustainability/sustainability-pdfs/COTE-D%27IVOIRE-ofi-sustainable-cocoa-suppliers-2022.pdf
Ofi,cooperative agricole des amis de la nature de man,coopanam,Man,https://www.ofi.com/content/dam/olamofi/sustainability/sustainability-pdfs/COTE-D%27IVOIRE-ofi-sustainable-cocoa-suppliers-2022.pdf
Ofi,cooperative agricole de ousmanekro,coopaou,San Pedro,https://www.ofi.com/content/dam/olamofi/sustainability/sustainability-pdfs/COTE-D%27IVOIRE-ofi-sustainable-cocoa-suppliers-2022.pdf
Ofi,societe cooperative des agriculteurs sante-marie de doba,coopasm,Dagadji,https://www.ofi.com/content/dam/olamofi/sustainability/sustainability-pdfs/COTE-D%27IVOIRE-ofi-sustainable-cocoa-suppliers-2022.pdf
Ofi,societe cooperative la paix de la tene-sangoue,coopatesa,Oumé,https://www.ofi.com/content/dam/olamofi/sustainability/sustainability-pdfs/COTE-D%27IVOIRE-ofi-sustainable-cocoa-suppliers-2022.pdf
Ofi,cooperative agricole yeyonian d'apprompron afewa,coopayaf,Apprompron,https://www.ofi.com/content/dam/olamofi/sustainability/sustainability-pdfs/COTE-D%27IVOIRE-ofi-sustainable-cocoa-suppliers-2022.pdf
Ofi,cooperative agricole des producteurs de zaranou,coopaza,Abengourou,https://www.ofi.com/content/dam/olamofi/sustainability/sustainability-pdfs/COTE-D%27IVOIRE-ofi-sustainable-cocoa-suppliers-2022.pdf
Ofi,societe cooperative agricole zemees taaba de gbagbam,coopazeg,Gbagbam,https://www.ofi.com/content/dam/olamofi/sustainability/sustainability-pdfs/COTE-D%27IVOIRE-ofi-sustainable-cocoa-suppliers-2022.pdf
Ofi,cooperative avec consentement des agriculteurs du goh,coop-ca a-goh,Gagnoa,https://www.ofi.com/content/dam/olamofi/sustainability/sustainability-pdfs/COTE-D%27IVOIRE-ofi-sustainable-cocoa-suppliers-2022.pdf
Ofi,societe cooperative avec conseil d'administration liberte de dania,coop-ca coalidan,Monokozohi,https://www.ofi.com/content/dam/olamofi/sustainability/sustainability-pdfs/COTE-D%27IVOIRE-ofi-sustainable-cocoa-suppliers-2022.pdf
Ofi,"societe cooperative avec conseil dadministration
nainere de gnato",coop-ca coangna,Gnato,https://www.ofi.com/content/dam/olamofi/sustainability/sustainability-pdfs/COTE-D%27IVOIRE-ofi-sustainable-cocoa-suppliers-2022.pdf
Ofi,societe cooperative agricole de amanikro,coop-ca coopaa,Dagadji,https://www.ofi.com/content/dam/olamofi/sustainability/sustainability-pdfs/COTE-D%27IVOIRE-ofi-sustainable-cocoa-suppliers-2022.pdf
Ofi,"cooperative avec conseil d'administration
des cooperateurs agricole binkadi de kononfla",coop-ca coopabin,Gagnoa,https://www.ofi.com/content/dam/olamofi/sustainability/sustainability-pdfs/COTE-D%27IVOIRE-ofi-sustainable-cocoa-suppliers-2022.pdf
Ofi,societe cooperative agricole de dobre,coop-ca coopado,Gnago 1,https://www.ofi.com/content/dam/olamofi/sustainability/sustainability-pdfs/COTE-D%27IVOIRE-ofi-sustainable-cocoa-suppliers-2022.pdf
Ofi,nouvelle entreprise cooperative agricole de bagolieoua,coop-ca necab,Grand-Zattry,https://www.ofi.com/content/dam/olamofi/sustainability/sustainability-pdfs/COTE-D%27IVOIRE-ofi-sustainable-cocoa-suppliers-2022.pdf
Ofi,cooperative avec conseil d'administration des agriculteurs de bokeleloua,coop-ca-abo,Soubré,https://www.ofi.com/content/dam/olamofi/sustainability/sustainability-pdfs/COTE-D%27IVOIRE-ofi-sustainable-cocoa-suppliers-2022.pdf
Ofi,societe cooperative agricole des producteurs de lobogrou,coop-ca-capl,Lobogrou/ Lakota,https://www.ofi.com/content/dam/olamofi/sustainability/sustainability-pdfs/COTE-D%27IVOIRE-ofi-sustainable-cocoa-suppliers-2022.pdf
Ofi,societe cooperative avec conseil d'administration des producteurs agricoles de niable,coop-ca-pan,Abengourou,https://www.ofi.com/content/dam/olamofi/sustainability/sustainability-pdfs/COTE-D%27IVOIRE-ofi-sustainable-cocoa-suppliers-2022.pdf
Ofi,societe cooperative agricole de guitry,coop-ca-socoagui,Guitry,https://www.ofi.com/content/dam/olamofi/sustainability/sustainability-pdfs/COTE-D%27IVOIRE-ofi-sustainable-cocoa-suppliers-2022.pdf
Ofi,cooperative avec conseil d'administration unite de danane,coop-ca-udan,Mahapleu,https://www.ofi.com/content/dam/olamofi/sustainability/sustainability-pdfs/COTE-D%27IVOIRE-ofi-sustainable-cocoa-suppliers-2022.pdf
Ofi,cooperative agricole des producteurs de divo,coopradi,DIVO,https://www.ofi.com/content/dam/olamofi/sustainability/sustainability-pdfs/COTE-D%27IVOIRE-ofi-sustainable-cocoa-suppliers-2022.pdf
